"What kind of hat are you?"|"Find out what type of hat you are"|"Millennium Falcon"|Mouse|Children|Spagetti
"How many fingers do you have?"|"I can't count"|1738|10|"What's a finger?"
"What's your favorite kitchen appliance?"|Microwave|Horseradish|Bowl|Cabinet
"Where are you from?"|"You're mom"|"Whom'sst ever"|Alabama|"Heaven :)"
"What's your favorite animal?"|"A clam"|"An oyster"|"Sea cucumber"|"Moose antlers"
"Do you like Sam Mahoney?"|"No way"|"He smells bad"|"I hate him"|Dislike
"What's your education level?"|"I can hold a conversation"|"I met Will Hunting once"|"njgfdfbvsio fgjnghkdk"|"1 + 2 = 19874598145897641234"
What?|"The weather is nice out"|"I hate concrete"|"Do rocks have feelings?"|"I live in a box"
